Language,Source,Collector,Link,Question,Question (English),Top Answer,Top Answer (English)
Arabic,Ujeeb,615039e5815124bccc71c92b,https://www.ejaba.com/question/%D9%85%D8%A7-%D9%87%D9%88-%D8%A7%D9%84%D8%B8%D9%87%D8%A7%D8%B1,ما هو الظهار؟,What is dhahir?,"تعريف الظِّهار
يُعرّف الظِّهار في اللغة والاصطلاح كما يأتي: تعريف الظِّهار لغةً: الظِّهار في اللغة مصدرٌ، والفعل منه: ظاهر، فيُقال: ظاهر من امرأته؛ أي قال لها: ""أنت عليّ كظَهْر أمي"".

تعريف الظِّهار شرعاً: تشبيه الرجل لزوجته، أو لجزءٍ منها، بإحدى النساء المحرّمات عليه تحريماً مؤبّداً، ومثاله: أن يقول الرجل لزوجته: ""أنت عليّ كظَهْرِ أمي""، أو ""كظَهْرِ أختي""، أو ""نِصفُكِ عليّ كظَهْرِ أمي"".

حكم الظِّهار
الظّهار مُحرَّمٌ بإجماع العلماء؛ استناداً لعددٍ من الأدلّة، فيما يأتي بيانها: قال الله -تعالى-: (الَّذِينَ يُظَاهِرُونَ مِنكُم مِّن نِّسَائِهِم مَّا هُنَّ أُمَّهَاتِهِمْ إِنْ أُمَّهَاتُهُمْ إِلَّا اللَّائِي وَلَدْنَهُمْ وَإِنَّهُمْ لَيَقُولُونَ مُنكَرًا مِّنَ الْقَوْلِ وَزُورًا وَإِنَّ اللَّـهَ لَعَفُوٌّ غَفُورٌ)، فاعتُبر الظِّهار من قول الزور والمُنكر، الذي يعدّ من كبائر الذنوب التي ورد النهي عنها.

قال -عزّ وجلّ-: (وَمَا جَعَلَ أَزْوَاجَكُمُ اللَّائِي تُظَاهِرُونَ مِنْهُنَّ أُمَّهَاتِكُمْ).

جاء في السنّة النبويّة، من حديث أوس بن الصامت، أنّ زوجته اشتكت للنبي -عليه الصلاة والسلام- مُظاهرة زوجها لها، فأنزل الله -تعالى- سورة المجادلة.

حرّمت الشريعة الإسلاميّة الظِّهار، وأبطلته، ورتّبت على من ظَاهَرَ زوجته، وأراد العودة إليها، كفّارةً؛ عقوبةً، وزجراً له عن فعله، إذ إنّ الظِّهار مخالفٌ لحقيقة الأمور، كما أنّ فيه ظلمٌ بالزوجة، وإلحاقٌ للضرر بها.

حكم الظِّهار المؤقّت
الظِّهار المؤقّت؛ هو الظِّهار المحدّد بمدّة زمنيّةٍ معينةٍ، كأن يقول الزوج لزوجته: ""أنتِ عليّ كظَهْرِ أمي ليومٍ أو لشهرٍ""، واختلف العلماء فيما يترتّب عليه، وذهبوا في ذلك إلى قولين، بيانهما فيما يأتي: القول الأول: ذهب جمهور أهل العلم من الحنفيّة، والحنابلة، والشافعيّة إلى القول بجواز التأقيت في الظِّهار، وزوال أثَرِه بانقضاء المدّة المحدّدة، دون ترتّب الكفّارة على الزوج، إلّا أنّ وطأه لها خلال هذه المدّة يُلزِمه الكفّارة، واستدلّوا بما رُوي عن سلمة بن صخر البياضي، أنّه قال: (ظاهَرْتُ مِن امرأتي حتى يَنْسِلَخَ شهرُ رمضانَ، وأَخْبَرَ النبيَّ أنه أصابَ فيه، فأمَرَه بالكفَّارةِ).

القول الثاني: خالف المالكية جمهور أهل العلم؛ فقالوا بأنّ الظهار يقع، ولكنّه يقعُ مؤبّداً؛ فيسقط التأقيت، ويثبت الظّهار، ولا تحلّ الزوجة به إلّا بأداء الكفّارة، إذ اللفظ يُحرّم الزوجة، ولا يُحدّد بمدّةٍ، قياساً على الطلاق.

أركان الظِّهار وشروطه
بيّن العلماء أركان وشروط الظِّهار، فيما يأتي بيانها: الزوج: ويطلق عليه المُظاهِر، ويشترط فيه أن يكون عاقلاً، بالغاً، مُختاراً، وهي ذات الأمور المشروطة في المُطلِّق ليصحّ وقوع الطلاق منه.

الزوجة: ويُشترط فيها ما يُشترط لوقوع الطلاق عليها، وإن كانت في العدّة من طلاقٍ رجعيٍ، سواءً كان الظِّهار قبل الدخول، أم بعده، ولا يصحّ الظِّهار من الأجنبيّة، كأن يقول الرجل لأجنبيةٍ عنه: ""إن تزوّجتكِ فأنتِ عليّ كظَهْرِ أمي"".

الصيغة: والصيغة في الظِّهار إمّا أن تكون صريحةً، أو كنائيةً، ومن أمثلة الألفاظ الصريحة؛ أن يقول الرجل لزوجته: ""أنتِ عليّ كظَهْرِ أمي""، أو يقول: ""أنتِ معي، أو عندي، أو لي كظَهْرِ أمي""، ومن الألفاظ الصريحة أيضاً؛ قول الرجل لزوجته: ""أنتِ عَلَيّ كبَدَن أو جسم أمي""، وكذلك إن ذكر أي جزءٍ من زوجته، كأن يقول: ""نِصفُكِ، أو رُبعُكِ""، ومن الصِيغ الكنائيّة؛ أن يقول الرجل لزوجته: ""أنتِ عَلَيّ كرُوح أمي، أو رأسها""؛ فحينئذٍ يُنظر في نيّته؛ فإن أراد الظِّهار وقع ظِهارُه، وإن أراد غير ذلك لم يقع، باعتبار الألفاظ الكنائيّة تُفيد الظِّهار، وغيره، كما قد تُستخدم في العُرف لغير الظِّهار، فكان لازماً تحديد النيّة.

المُشبّه به: وهو الطرف الذي يقع عليه تشبيه الزوجة به؛ كالأمّ، وغيرها من النساء المحرّمات على الزوج حُرمةً مؤبّدةً، سواءً كان سبب التحريم النسب، أو المُصاهرة، أو الرِّضاعة، ويستثنى من ذلك مَن كنَّ حلالاً للزوج في وقتٍ ما قبل التحريم، مثل: زوجة الابن، والمُرضِعَة.

الآثار المترتّبة على الظِّهار
تترتّب عدّة آثارٍ على الظِّهار بتحقّق شروطه، فيما يأتي بيانها:

تحريم استمتاع الرجل بزوجته بسبب الظِّهار
يُحرّم على الرجل الاستمتاع بزوجته بسبب الظِّهار، قبل أداء الكفّارة المترتّبة عليه، سواءً كان الاستمتاع بالوطء، أو بمقدّماته؛ مثل: اللمس، أو التقبيل، أو المباشرة دون الوطء، وعلى ذلك أجمع العلماء، استدلالاً بقول الله -تعالى-: (وَالَّذِينَ يُظَاهِرُونَ مِن نِّسَائِهِمْ ثُمَّ يَعُودُونَ لِمَا قَالُوا فَتَحْرِيرُ رَقَبَةٍ مِّن قَبْلِ أَن يَتَمَاسَّا ذَلِكُمْ تُوعَظُونَ بِهِ وَاللَّـهُ بِمَا تَعْمَلُونَ خَبِيرٌ)، ولِما ورد في السنّة النبويّة أنّ رجلاً ظاهر امرأته، ثمّ جامعها قبل أن يكفّر عن مظاهرته لها، فأعلم النبي بذلك، فأمره بالاستغفار، وعدم العودة إلى ذلك الفعل حتى يكفّر عن مظاهرته لامرأته؛ يدلّ ذلك على حُرمة الوطء بعد الظِّهار قبل التكفير عنه، ووجوب الاستغفار عن الظِّهار؛ ممّا يدلّ على أنّه ذنبٌ محرّم الارتكاب، كما أنّ مُطلق النهي يدلّ على تحريم الأمر المنهي عنه؛ أي تحريم العودة إلى الوطء بعد الظهار، دون التكفير عنه.

أما دواعي ومقدّمات الوطء؛ فأهل العلم في المسألة على قولين، وبيانهما فيما يأتي: القول الأول: قال الحنفيّة، وأكثر المالكيّة، ورواية عن الإمام أحمد؛ بتحريم دواعي ومقدّمات الوطء قبل أداء كفّارة الظِّهار، وقد استدلّوا على ذلك بقول الله -تعالى-: (فَتَحْرِيرُ رَقَبَةٍ مِّن قَبْلِ أَن يَتَمَاسَّا)، ووجه الاستدلال من الآية أنّ لفظ (التماس) الوارد فيها يدلّ على اللمس باليد، أو بغيرها من أعضاء الجسم، ولأنّ الوطء مُحرّمٌ قبل الكفّارة، فإنّ الدواعي إليه، كاللمس، والتقبيل، والمباشرة دون الفرج مُحرّمةٌ؛ إذ إنّها تؤدّي إليه، كما نصّت القاعدة الشرعيّة: ""ما أدّى إلى الحرام حرامٌ"".

القول الثاني: قال الشافعيّة، وبعض المالكيّة، والإمام أحمد بن حنبل في رواية عنه؛ بإباحة دواعي ومقدّمات الوطء، وعدم تحريمها قبل أداء كفّارة الظِّهار، وقد استدلّوا على ذلك بأنّ المقصود من التماس المحرّم قبل التكفير عن الظِّهار هو: الجِماع بين الرجل وزوجته، ودليلهم في ذلك قول الله -تعالى- في الآية الأخرى: (وَإِن طَلَّقْتُمُوهُنَّ مِن قَبْلِ أَن تَمَسُّوهُنَّ)، فقالوا إنّ المقصود باللمس في الآية: الجِماع، كما استدلّوا على إباحة دواعي الوطء قبل التكفير عن الظِّهار بإباحتها أثناء الحيض والنفاس، مع تحريم الوطء في مدّتهما؛ بالنظر إلى أنّ الوطء مُحرّمٌ في الحيض والظِّهار.

أداء كفّارة الظِّهار
يلزم الزوج الذي ظاهر زوجته أداء كفّارةٍ واحدةٍ؛ للتكفير عن ذنبه، قال الله -سبحانه-: (فَتَحْرِيرُ رَقَبَةٍ مِّن قَبْلِ أَن يَتَمَاسَّا)، وتجدر الإشارة إلى أنّ الكفّارة لا تسقط عن المُظاهر بأيّ حالٍ، وإن وَطِئ زوجته قبل أدائها، كما استدلّوا بما رُوي عن عبدالله بن عباس -رضي الله عنهما-: (أنَّ رجلًا أتى النَّبيَّ صلَّى اللَّهُ عليهِ وسلَّمَ، قَد ظاهرَ منَ امرأتِهِ فوقعَ علَيها، فقالَ: يا رسولَ اللَّهِ، إنِّي ظاهَرتُ منَ امرأتي فوَقعتُ قبلَ أن أُكَفِّرَ، قالَ: وما حَملَكَ على ذلِكَ يرحَمُكَ اللَّهُ؟ قالَ: رأيتُ خُلخالَها في ضوءِ القمرِ، فقالَ: لا تَقرَبْها حتَّى تفعلَ ما أمرَ اللَّهُ عزَّ وجلَّ)، فالمرأة التي ظاهرها زوجها تبقى مُحرّمةٌ عليه، وإن وقع الوطء قبل التكفير، ولا تُرفَع الحُرمة عنه إلّا بأداء الكفّارة.

مشروعيّة كفّارة الظِّهار
ثبتت مشروعيّة الكفّارة من الظِّهار في القرآن الكريم، والسنّة النبويّة المُطهّرة، وفيما يأتي ذِكر الأدلّة: قول الله -تعالى-: (وَالَّذِينَ يُظَاهِرُونَ مِن نِّسَائِهِمْ ثُمَّ يَعُودُونَ لِمَا قَالُوا فَتَحْرِيرُ رَقَبَةٍ مِّن قَبْلِ أَن يَتَمَاسَّا ذَلِكُمْ تُوعَظُونَ بِهِ وَاللَّـهُ بِمَا تَعْمَلُونَ خَبِيرٌ*فَمَن لَّمْ يَجِدْ فَصِيَامُ شَهْرَيْنِ مُتَتَابِعَيْنِ مِن قَبْلِ أَن يَتَمَاسَّا فَمَن لَّمْ يَسْتَطِعْ فَإِطْعَامُ سِتِّينَ مِسْكِينًا ذَلِكَ لِتُؤْمِنُوا بِاللَّـهِ وَرَسُولِهِ وَتِلْكَ حُدُودُ اللَّـهِ وَلِلْكَافِرِينَ عَذَابٌ أَلِيمٌ).

ما جاء في السنّة النبويّة من قول خولة بنت ثعلبة: (ظاهرَ منِّي زَوجي أوسُ بنُ الصَّامتِ فَجِئْتُ رسولَ اللَّهِ صلَّى اللَّهُ عليهِ وسلَّمَ أشكو إِليهِ ورسولُ اللَّهِ صلَّى اللَّهُ عليهِ وسلَّمَ يجادِلُني فيهِ ويقولُ اتَّقي اللَّهَ فإنَّهُ ابنُ عمِّكِ فما بَرِحْتُ حتَّى نزلَ القرآنُ قَدْ سَمِعَ اللَّهُ قَوْلَ الَّتِي تُجَادِلُكَ فِي زَوْجِهَا إلى الفَرضِ فقالَ يُعتِقُ رقَبةً قالَت لا يَجِدُ قالَ فيَصومُ شَهْرينِ مُتَتابِعَينِ قالَتْ يا رسولَ اللَّهِ إنَّهُ شيخٌ كبيرٌ ما بهِ مِن صيامٍ قالَ فَليُطعِمْ ستِّينَ مِسكينًا قالَتْ ما عندَهُ مِن شيءٍ يتَصدَّقُ بهِ قالَت فأُتِيَ ساعتَئذٍ بعَرَقٍ من تَمرٍ قُلتُ يا رسولَ اللَّهِ فإنِّي أعينُهُ بِعَرَقٍ آخرَ قالَ قد أحسَنتِ اذهَبي فأطعِمي بِها عنهُ ستِّينَ مسكينًا وارجِعي إلى ابنِ عمِّكِ قالَ والعَرَقُ ستُّونَ صاعًا).

صفات كفّارة الظِّهار
بيّن العلماء صفات كفّارة الظِّهار كما حُدّدت في كتاب الله، وسُنّة نبيّه بثلاثة أنواعٍ تُؤدّى وِفق الترتيب، بحيث لا يتمّ الانتقال إلى الأخرى إلى حين العجز عن أداء التي قبلها، وبذلك تُؤدّى كفّارة الظِّهار المُتوجّبة في حقّ من ظاهر زوجته باتّفاق العلماء، وهي على الترتيب: تحرير رقبةٍ.

صيام شهرَين متتابعَين.للمزيد من التفاصيل عن كفارة صيام شهرين متتابعين الاطّلاع على مقالة: ((صيام شهرين متتابعين)).إطعام ستّين مسكيناً إن تحقّق العجز عن الصيام.

وقت كفّارة الظِّهار
لا تجب كفّارة الظِّهار قبل العودة عنه؛ فإن مات أحد الزوجين المتظاهرَين، أو وقعت الفُرقة بينهما فلا كفّارةٌ؛ إذ إنّها متعلّقةٌ بالعودة؛ استدلالاً بقول الله -تعالى-: (وَالَّذِينَ يُظَاهِرُونَ مِن نِّسَائِهِمْ ثُمَّ يَعُودُونَ لِمَا قَالُوا فَتَحْرِيرُ رَقَبَةٍ مِّن قَبْلِ أَن يَتَمَاسَّا ذَلِكُمْ تُوعَظُونَ بِهِ وَاللَّـهُ بِمَا تَعْمَلُونَ خَبِيرٌ)، وبقياس الظِّهار على اليمين، فكما أنّ اليمين لا تترتّب الكفّارة عليها إلّا بالمخالفة، فإنّ كفّارة الظِّهار لا تتحقّق إلّا بالعودة عنه، وتجدر الإشارة إلى أنّ العلماء اختلفوا في تفسير العودة عن الظِّهار؛ وبيان أقوالهم في ذلك آتياً: القول الأول: قال الحنفيّة، والمالكيّة بأنّ العودة عن الظِّهار تكون بالعزم على الجِماع، أو إرادته.

القول الثاني: قال الشافعيّة بأنّ المقصود بالعودة عن الظِّهار إمساك الزوجة مدّةً من الزمن يُمكن وقوع الطلاق فيها؛ لأنّ الظِّهار يجعل الزوجة بائنةً من زوجها، فترجع بإمساكها، إذ إنّه شبّه زوجته بأمّه؛ ممّا يعني أنّه غير مُمسكٍ لها، فيُراجعها بإمساكها.

القول الثالث: قال الحنابلة بأنّ العودة عن الظِّهار تكون بالوطء؛ إذ إنّ مَن ظاهر زوجته كأنّه حلف يميناً على عدم جِماع زوجته، فيُراجعها بفعل ما حلف عليه، ولا تتحقّق العودة بالكلام؛ لأنّها ستُناقض حينها ألفاظ الظِّهار.

منع الزوجة زوجها من الوطء قبل أداء كفّارة الظِّهار
يحقّ للزوجة منع زوجها من وطئها قبل أداء كفّارة الظِّهار، كما يثبت حقّها في المطالبة بالوطء؛ باعتباره من حقوقها الزوجيّة الواجبة على الزوج؛ بأن يُؤدّي الزوج الكفّارة، فإن امتنع، فإنّه يحقّ للزوجة رفع أمرها للقاضي؛ بسبب وقوع الضرر عليها؛ بامتناع زوجها عن أداء الكفّارة، وبالتالي فوات حقٍّ من حقوقها.

انتهاء حكم الظِّهار
ينتهي الظِّهار، وينحلّ بتحقّق ثلاثة أمورٍ، بيانها فيما يأتي: أداء كفّارة الظِّهار التي حُدّدت بنصوص القرآن، والسنة، والتي تمّ بيانها سابقاً.

انتهاء مدة الظِّهار إن كان مؤقّتاً، وذلك بالنسبة لمن قال بجوازه، وصحّته، وانتهائه بانتهاء المدّة.

وفاة أحد الزوجين، أو كليهما؛ لأنّ الظِّهار مُتعلّقٌ بكليهما، ولا يُتصوَّر وجوده بغياب أحدهما.","Definition of zihar
Zihar is defined in language and terminology as follows: Definition of zihar linguistically: Zihar in the language is a noun, and the verb of it is: zahiar, so it is said: zihar is apparent from his wife; That is, he said to her: “You are on me like my mother’s back.”

The definition of zihaar according to Islamic law is: a man likening his wife, or part of her, to one of the women who is permanently forbidden to him. For example: a man saying to his wife: “You are upon me like my mother’s back,” or “like my sister’s back,” or “Half of you is upon me like my mother’s back.”

The rule of zihar
Dhahar is forbidden according to scholarly consensus. Based on a number of pieces of evidence, as follows: God Almighty said: (Those of you who pretend to be innocent of their mothers are not their mothers. Indeed, their mothers are only those who gave birth to them. Indeed, they say it is an abomination Speech is false, and indeed, God is Most Pardoning and Forgiving), so zihaar is considered false and reprehensible speech, which is considered It is one of the major sins that has been forbidden.

God Almighty said: (And He has not made the wives with whom you support your mothers your mothers).

It was mentioned in the Sunnah of the Prophet, from the hadith of Aws ibn al-Samit, that his wife complained to the Prophet - peace and blessings be upon him - about her husband’s demonstration of her behavior towards her, so God Almighty revealed Surah Al-Mujadila.

Islamic law forbade zihaar, abolished it, and required that anyone who had zihaar with his wife and wanted to return to her must perform atonement. As a punishment, and to discourage him from his action, as zihar is contrary to the reality of matters, and it also constitutes injustice to the wife, and causes harm to her.

Temporary zihar ruling
Temporary epithelium; It is zihaar specified for a specific period of time, such as when the husband says to his wife: “You are upon me like my mother’s back for a day or for a month.” The scholars differed as to what it entails, and they came to two opinions about it, which are explained as follows: The first opinion: The majority of scholars from the Hanafi and Hanbali schools of thought said: The Shafi’is are of the opinion that it is permissible to have intercourse with zihaar, and that its effect will disappear with the expiration of the specified period, without requiring expiation for the husband, except that his intercourse with her during this period requires expiation, and they cited as evidence what was narrated on the authority of Salamah bin Sakhr Al-Bayadhi, that he said: (I have sexual intercourse with my wife until the month of Ramadan has passed. The Prophet was informed that he had done wrong, so he ordered him to make atonement.

The second opinion: The Malikis disagreed with the majority of scholars. They said that zihar is valid, but it is valid forever. Thus, the taqīt is dropped, and the zihar is confirmed, and the wife is not permitted to do so except by performing expiation, as the wording deprives the wife, and does not specify a period, by analogy with divorce.

Pillars and conditions of zihar
Scholars have explained the pillars and conditions of zihaar, as follows: The husband: He is called the zihaar, and he is required to be sane, adult, and voluntary. These are the same conditions that are required for a divorced person in order for a divorce to occur from him to be valid.

Wife: The same conditions are required for the divorce to take place against her, even if she is in the waiting period of a revocable divorce, whether the zihaar was before consummation or after it. The zihaar from a foreign woman is not valid, as if a man says to a foreign woman to him: “If I marry you, then you are to me like my mother’s back.”

Formula: The formula in Dhihaar can either be explicit or metaphorical, and examples of explicit words include: For a man to say to his wife: “You are to me like my mother’s back,” or to say: “You are with me, or to me, or to me like my mother’s back,” and also from explicit words; A man’s saying to his wife: “You are to me like my mother’s body,” and likewise if he mentioned any part of his wife, such as saying: “Half of you, or a quarter of you,” and among the metaphorical forms; For a man to say to his wife: “You are to me like my mother’s soul or head.” Then his intention is considered; If he intended to perform zihaar, his zihaar occurred, and if he intended otherwise, it did not occur, considering the metaphorical words used to indicate the zihaar, and others, as they may be used in custom for people other than the zihaar, so it was necessary to specify the intention.

The one who is likened to him: He is the party to whom the wife is likened to him. Such as the mother, and other women who are permanently forbidden to the husband, whether the reason for the prohibition is lineage, intermarriage, or breastfeeding. An exception to this is those who were permissible for the husband at a time before the prohibition, such as: the son’s wife and the breastfeeding woman.

Effects on the appearance
There are several effects on zihar if its conditions are met, as follows:

Prohibiting a man from enjoying his wife because of zihaar
It is forbidden for a man to have sexual intercourse with his wife because of zihaar, before performing the expiation required of him, whether it is sexual intercourse or its introduction. Such as: touching, kissing, or intercourse without intercourse, and the scholars have unanimously agreed upon that, citing the words of God Almighty: (And those of them who are intimate with their wives and then go back to what they said - freeing a slave before they touch - of that you will be warned And God is Aware of what you do.) And when it was narrated In the Sunnah of the Prophet, a man had intercourse with his wife, then had intercourse with her before he made amends for his appearance with her. He informed the Prophet of that, so he ordered him to seek forgiveness, and not to return to that act until he made amends for his appearance with his wife. This indicates the prohibition of intercourse after zihar before atonement for it, and the necessity of seeking forgiveness for zihar. Which indicates that it is a forbidden sin to commit, just as the absolute prohibition indicates the prohibition of the forbidden matter. That is, it is forbidden to return to intercourse after zihar, without atonement for it.

As for the reasons and introductions to intercourse: The people of knowledge on the issue have two opinions, and their explanation is as follows: The first opinion: said by the Hanafi school, most of the Maliki school of thought, and a narration on the authority of Imam Ahmad. By prohibiting the reasons and precedents for intercourse before performing the expiation of zihar, and they have proven this with the words of God Almighty: (So freeing a neck before they touch), and the inference from the verse is that the word (touching) mentioned in it indicates touching with the hand, or with other parts of the body, Because intercourse is forbidden before expiation, the reasons for it, such as touching, kissing, and intercourse without the private parts, are forbidden. Because it leads to it, as the Sharia rule states: “Whatever leads to what is forbidden is forbidden.”

The second opinion: The Shafi’is, some Malikis, and Imam Ahmad ibn Hanbal said in a narration from him: By permitting the reasons and precedents for intercourse, and not prohibiting it before performing the atonement for zihaar, they have proven that that what is meant by the forbidden intercourse before expiation for zihar is: intercourse between a man and his wife, and their evidence for that is the words of God Almighty in the other verse: (And if you divorce them before Touch them. They said that what is meant by touching in the verse is intercourse. They also demonstrated the permissibility of reasons for intercourse before atonement for zihaar by permissible during menstruation and postpartum, while forbidding intercourse during their period. Given that intercourse is forbidden during menstruation and zihar.

Performing the atonement of zihar
The husband who has sexual intercourse with his wife is required to perform one expiation. To atone for his sin, God - Glory be to Him - said: (So free a slave before they touch each other), and it should be noted that the atonement is not waived for the apparent sins under any circumstances, even if he had intercourse with his wife before performing it, as they cited as evidence what was narrated on the authority of Abdullah bin Abbas - may God be pleased with them both - : (A man came to the Prophet, may God’s prayers and peace be upon him, and he had intercourse with his wife and fell on her. He said: O Messenger of God, I had intercourse with my wife and fell before I made amends. He said: What made you do that, may God have mercy on you? He said: I saw her anklets on me moonlight, He said: Do not approach her until she has done what God Almighty has commanded. The woman whose husband appears to be her husband remains forbidden to him, even if the intercourse occurred before expiation, and his sanctity will not be lifted except by performing expiation.

The legitimacy of zihar atonement
The legitimacy of expiation from zihaar has been proven in the Noble Qur’an and the purified Sunnah of the Prophet, and the evidence is mentioned below: God Almighty’s saying: This is what you are being advised about, and God is Aware of what you do. *So whoever does not find So fasting for two consecutive months before touching each other, and whoever is not able, then feeding sixty poor people. This is so that you may believe in God and His Messenger, and that is the limit The love of God, and for the disbelievers is a painful punishment.)

What was mentioned in the Sunnah of the Prophet from the words of Khawla bint Tha’labah: “My husband, Aws ibn al-Samit, appeared on my side, so I came to the Messenger of God, may God bless him and grant him peace, complaining to him, and the Messenger of God, may God bless him and grant him peace, argued with me about him and said, “Fear God, for he is your cousin,” and he continued Until the Qur’an was revealed, God heard what you said The one who disputes with you about her husband over the obligation. He said, “He should free a slave.” She said, “He cannot find any.” He said, “Then he should fast for two consecutive months.” She said, “O Messenger of God, he is an old man and there is no need to fast.” He said, “Let him feed sixty poor people.” She said, “He has nothing.” He should give it in charity. She said, “At that time a bunch of dates was brought.” I said, “O Messenger of God, I will help him.” With another iraq, he said, “You have done well. Go and feed sixty poor people with it on his behalf, and go back to your cousin.” He said, “The iraq is sixty saa’s.”

Characteristics of zihar atonement
The scholars explained the characteristics of the zihar’s expiation as specified in the Book of God and the Sunnah of His Prophet, with three types that are performed according to the order, such that one does not move to the other until one is unable to perform the one before it. Thus, the obligatory zihar’s expiation is performed against his wife’s apparent husband according to the agreement of the scholars, and they are in order: Freeing a neck.

Fasting for two consecutive months. For more details about the expiation for fasting for two consecutive months, see the article: ((Fasting for two consecutive months)). Feeding sixty poor people if one is unable to fast.

The time of atonement for zihar
It is not necessary to make atonement for zihaar before returning from it. If one of the pretending spouses dies, or separation occurs between them, there is no expiation. As it is related to return; As evidence from the words of God Almighty: (And those of their wives who go back to what they said and free a slave before they come into contact with each other - you will be admonished therein. By God, you will be advised of what you have learned An expert in color), and by the analogy of the zihaar on the oath, just as an oath does not entail expiation except by violating it, the expiation of the zihar does not entail It can only be achieved by returning from it, and it should be noted that scholars differed in the interpretation of returning from it. Their statements in this regard are explained below: The first opinion: The Hanafis and Malikis said that returning from zihaar is by resolving to have intercourse, or by his will.

The second opinion: The Shafi’is said that what is meant by reversing the zihaar is the wife’s imprisonment for a period of time during which divorce can take place. Because zihar makes the wife estranged from her husband, so she returns by keeping her, since he likened his wife to his mother. Which means that he is not holding it, so he returns it by holding it.

The third opinion: The Hanbalis said that returning from zihaar is through intercourse. As if someone appears to his wife, it is as if he swore an oath not to have intercourse with his wife, so he takes her back by doing what he swore to do, and the return is not achieved by words; Because it would then contradict the words of Al-Zahhar.

The wife prevents her husband from having intercourse before performing the expiation of zihar
The wife has the right to prevent her husband from having intercourse with her before performing the atonement for zihar, and her right to demand intercourse is also proven. As one of her marital rights obligatory upon the husband; That the husband performs atonement. If he refuses, the wife has the right to raise her matter to the judge. Because of damage to it; By her husband’s refusal to perform the expiation, thus missing out on one of her rights.

The end of the rule of Zahhar
Dhihaar ends and is dissolved with the fulfillment of three things, explained below: Performing the atonement for Dhihaar, which was specified in the texts of the Qur’an and Sunnah, and which was explained previously.

The end of the period of zihar, if it is temporary, for those who say that it is permissible, valid, and ends with the end of the period.

Death of one or both spouses; Because zihar is related to both of them, and its existence is inconceivable in the absence of one of them."
